{
 "schema": "ubl-activity-diagram-layout/1",
 "figure": "UBL-2.5-BillingwithCreditNoteProcess",
 "units": "px of the original PNG",
 "size": [
  3425,
  1813
 ],
 "style": {
  "fontPx": 38.6,
  "arrowPx": 51.5,
  "arrowWidthPx": 40.6,
  "arrowStyle": "open"
 },
 "rules": {
  "vertical": [
   {
    "at": 0,
    "width": 10,
    "span": [
     13,
     1799
    ]
   },
   {
    "at": 1811,
    "width": 4,
    "span": [
     13,
     1799
    ]
   },
   {
    "at": 3415,
    "width": 10,
    "span": [
     13,
     1799
    ]
   }
  ],
  "horizontal": [
   {
    "at": 0,
    "width": 10,
    "span": [
     13,
     3411
    ]
   },
   {
    "at": 1803,
    "width": 10,
    "span": [
     13,
     3411
    ]
   }
  ]
 },
 "greyRules": [],
 "lanes": {
  "lane0": {
   "x0": 0,
   "x1": 1813,
   "titleBox": [
    724,
    24,
    349,
    34
   ]
  },
  "lane1": {
   "x0": 1813,
   "x1": 3425,
   "titleBox": [
    2443,
    24,
    325,
    34
   ]
  },
  "lane2": {
   "y0": 0,
   "y1": 1813
  }
 },
 "nodes": {
  "n1": {
   "x": 3042,
   "y": 80,
   "w": 95,
   "h": 96
  },
  "n2": {
   "x": 1639,
   "y": 363,
   "w": 316,
   "h": 170,
   "shape": "rect",
   "stroke": 8,
   "rx": 0,
   "ry": 0,
   "bold": true,
   "labelLines": [
    {
     "x": 1726,
     "y": 421,
     "w": 148,
     "h": 32,
     "text": "Invoice"
    }
   ]
  },
  "n3": {
   "x": 326,
   "y": 390,
   "w": 491,
   "h": 94,
   "shape": "rounded",
   "stroke": 4,
   "rx": 48.0,
   "ry": 42,
   "bold": true,
   "labelLines": [
    {
     "x": 428,
     "y": 424,
     "w": 270,
     "h": 26,
     "text": "Receive Invoice"
    }
   ]
  },
  "n4": {
   "x": 2198,
   "y": 398,
   "w": 487,
   "h": 112,
   "shape": "rounded",
   "stroke": 5,
   "rx": 48,
   "ry": 50,
   "bold": true,
   "labelLines": [
    {
     "x": 2322,
     "y": 434,
     "w": 229,
     "h": 27,
     "text": "Raise Invoice"
    }
   ]
  },
  "n5": {
   "x": 1635,
   "y": 719,
   "w": 316,
   "h": 171,
   "shape": "rect",
   "stroke": 8,
   "rx": 0,
   "ry": 0,
   "bold": true,
   "labelLines": [
    {
     "x": 1679,
     "y": 777,
     "w": 232,
     "h": 33,
     "text": "Credit Note"
    }
   ]
  },
  "n6": {
   "x": 2908,
   "y": 722,
   "w": 366,
   "h": 177,
   "shape": "rhombus",
   "stroke": 5,
   "rx": 194,
   "ry": 96,
   "bold": false,
   "labelLines": [
    {
     "x": 3011,
     "y": 773,
     "w": 155,
     "h": 27,
     "text": "Reconcile"
    },
    {
     "x": 3010,
     "y": 820,
     "w": 134,
     "h": 34,
     "text": "Charges"
    }
   ]
  },
  "n7": {
   "x": 963,
   "y": 747,
   "w": 488,
   "h": 108,
   "shape": "rounded",
   "stroke": 5,
   "rx": 52,
   "ry": 56,
   "bold": true,
   "labelLines": [
    {
     "x": 1033,
     "y": 780,
     "w": 340,
     "h": 27,
     "text": "Receive Credit Note"
    }
   ]
  },
  "n8": {
   "x": 2099,
   "y": 761,
   "w": 488,
   "h": 98,
   "shape": "rounded",
   "stroke": 4,
   "rx": 48.0,
   "ry": 46.0,
   "bold": true,
   "labelLines": [
    {
     "x": 2191,
     "y": 795,
     "w": 299,
     "h": 27,
     "text": "Raise Credit Note"
    }
   ]
  },
  "n9": {
   "x": 2667,
   "y": 1059,
   "w": 277,
   "h": 23
  },
  "n10": {
   "x": 2946,
   "y": 1191,
   "w": 294,
   "h": 227,
   "shape": "rhombus",
   "stroke": 4,
   "rx": 155,
   "ry": 124,
   "bold": false,
   "labelLines": [
    {
     "x": 3015,
     "y": 1264,
     "w": 130,
     "h": 27,
     "text": "Validate"
    },
    {
     "x": 3018,
     "y": 1312,
     "w": 159,
     "h": 33,
     "text": "Response"
    }
   ]
  },
  "n11": {
   "x": 339,
   "y": 1192,
   "w": 291,
   "h": 226,
   "shape": "rhombus",
   "stroke": 4,
   "rx": 156,
   "ry": 123,
   "bold": false,
   "labelLines": [
    {
     "x": 415,
     "y": 1275,
     "w": 155,
     "h": 27,
     "text": "Reconcile"
    },
    {
     "x": 413,
     "y": 1322,
     "w": 135,
     "h": 34,
     "text": "Charges"
    }
   ]
  },
  "n12": {
   "x": 1650,
   "y": 1215,
   "w": 367,
   "h": 170,
   "shape": "rect",
   "stroke": 8,
   "rx": 0,
   "ry": 0,
   "bold": true,
   "labelLines": [
    {
     "x": 1694,
     "y": 1260,
     "w": 276,
     "h": 31,
     "text": "Invoice Status"
    },
    {
     "x": 1736,
     "y": 1309,
     "w": 193,
     "h": 38,
     "text": "Response"
    }
   ]
  },
  "n13": {
   "x": 2132,
   "y": 1246,
   "w": 575,
   "h": 126,
   "shape": "rounded",
   "stroke": 5,
   "rx": 31,
   "ry": 35,
   "bold": true,
   "labelLines": [
    {
     "x": 2176,
     "y": 1297,
     "w": 474,
     "h": 33,
     "text": "Receive Account Response"
    }
   ]
  },
  "n14": {
   "x": 956,
   "y": 1256,
   "w": 491,
   "h": 98,
   "shape": "rounded",
   "stroke": 4,
   "rx": 48.0,
   "ry": 46.0,
   "bold": true,
   "labelLines": [
    {
     "x": 984,
     "y": 1289,
     "w": 427,
     "h": 34,
     "text": "Send Account Response"
    }
   ]
  },
  "n15": {
   "x": 50,
   "y": 1278,
   "w": 64,
   "h": 65,
   "shape": "ellipse",
   "stroke": 4,
   "rx": 33,
   "ry": 28,
   "innerRatio": 0.453
  },
  "n16": {
   "x": 3054,
   "y": 1653,
   "w": 90,
   "h": 90,
   "shape": "ellipse",
   "stroke": 4,
   "rx": 44,
   "ry": 43,
   "innerRatio": 0.611
  },
  "n17": {
   "x": 450,
   "y": 1678,
   "w": 72,
   "h": 72,
   "shape": "rounded",
   "stroke": 5,
   "rx": 39,
   "ry": 34,
   "innerRatio": 0.5
  }
 },
 "flows": {
  "f0": {
   "fromPoint": [
    3091,
    190
   ],
   "toPoint": [
    3091,
    707
   ],
   "routing": "straight"
  },
  "f1": {
   "fromPoint": [
    1624,
    443
   ],
   "toPoint": [
    831,
    441
   ],
   "routing": "straight"
  },
  "f2": {
   "fromPoint": [
    2183,
    451
   ],
   "toPoint": [
    1969,
    448
   ],
   "routing": "straight"
  },
  "f3": {
   "fromPoint": [
    3078,
    707
   ],
   "toPoint": [
    2702,
    445
   ],
   "routing": "diagonal"
  },
  "f4": {
   "fromPoint": [
    484,
    498
   ],
   "toPoint": [
    484,
    1177
   ],
   "routing": "straight"
  },
  "f5": {
   "fromPoint": [
    2843,
    1043
   ],
   "toPoint": [
    2534,
    524
   ],
   "routing": "diagonal"
  },
  "f6": {
   "fromPoint": [
    2893,
    810
   ],
   "toPoint": [
    2601,
    810
   ],
   "routing": "straight"
  },
  "f7": {
   "fromPoint": [
    1620,
    804
   ],
   "toPoint": [
    1465,
    801
   ],
   "routing": "straight"
  },
  "f8": {
   "fromPoint": [
    2084,
    808
   ],
   "toPoint": [
    1965,
    804
   ],
   "routing": "straight"
  },
  "f9": {
   "fromPoint": [
    970,
    869
   ],
   "toPoint": [
    498,
    1177
   ],
   "routing": "diagonal"
  },
  "f10": {
   "fromPoint": [
    2675,
    1044
   ],
   "toPoint": [
    2357,
    873
   ],
   "routing": "diagonal"
  },
  "f11": {
   "fromPoint": [
    3091,
    1176
   ],
   "toPoint": [
    3091,
    913
   ],
   "routing": "straight"
  },
  "f12": {
   "fromPoint": [
    2931,
    1294
   ],
   "toPoint": [
    2782,
    1097
   ],
   "routing": "diagonal"
  },
  "f13": {
   "fromPoint": [
    1461,
    1303
   ],
   "toPoint": [
    1635,
    1300
   ],
   "routing": "straight"
  },
  "f14": {
   "fromPoint": [
    644,
    1304
   ],
   "toPoint": [
    941,
    1304
   ],
   "routing": "straight"
  },
  "f15": {
   "fromPoint": [
    2031,
    1300
   ],
   "toPoint": [
    2117,
    1309
   ],
   "routing": "diagonal"
  },
  "f16": {
   "fromPoint": [
    2721,
    1305
   ],
   "toPoint": [
    2931,
    1304
   ],
   "routing": "straight"
  },
  "f17": {
   "fromPoint": [
    324,
    1305
   ],
   "toPoint": [
    128,
    1309
   ],
   "routing": "straight"
  },
  "f18": {
   "fromPoint": [
    484,
    1432
   ],
   "toPoint": [
    484,
    1663
   ],
   "routing": "straight"
  },
  "f19": {
   "fromPoint": [
    3090,
    1432
   ],
   "toPoint": [
    3092,
    1638
   ],
   "routing": "straight"
  }
 },
 "texts": {
  "t2": {
   "x": 2751,
   "y": 267,
   "w": 171,
   "h": 176,
   "lines": [
    {
     "x": 2752,
     "y": 267,
     "w": 88,
     "h": 34,
     "text": "[initial"
    },
    {
     "x": 2751,
     "y": 315,
     "w": 171,
     "h": 33,
     "text": "charges or"
    },
    {
     "x": 2752,
     "y": 362,
     "w": 90,
     "h": 27,
     "text": "under"
    },
    {
     "x": 2751,
     "y": 409,
     "w": 137,
     "h": 34,
     "text": "charged]"
    }
   ]
  },
  "t3": {
   "x": 2769,
   "y": 719,
   "w": 138,
   "h": 80,
   "lines": [
    {
     "x": 2770,
     "y": 719,
     "w": 78,
     "h": 33,
     "text": "[over"
    },
    {
     "x": 2769,
     "y": 766,
     "w": 138,
     "h": 33,
     "text": "charged]"
    }
   ]
  },
  "t4": {
   "x": 3108,
   "y": 1042,
   "w": 148,
   "h": 81,
   "lines": [
    {
     "x": 3109,
     "y": 1042,
     "w": 147,
     "h": 34,
     "text": "[incorrect"
    },
    {
     "x": 3108,
     "y": 1090,
     "w": 136,
     "h": 33,
     "text": "charges]"
    }
   ]
  },
  "t5": {
   "x": 2675,
   "y": 1155,
   "w": 346,
   "h": 33,
   "lines": [
    {
     "x": 2675,
     "y": 1155,
     "w": 346,
     "h": 33,
     "text": "[incorrect information]"
    }
   ]
  },
  "t6": {
   "x": 147,
   "y": 1348,
   "w": 116,
   "h": 81,
   "lines": [
    {
     "x": 148,
     "y": 1348,
     "w": 115,
     "h": 33,
     "text": "[accept"
    },
    {
     "x": 147,
     "y": 1395,
     "w": 96,
     "h": 34,
     "text": "credit]"
    }
   ]
  },
  "t7": {
   "x": 3101,
   "y": 1476,
   "w": 153,
   "h": 80,
   "lines": [
    {
     "x": 3101,
     "y": 1476,
     "w": 153,
     "h": 33,
     "text": "[no action"
    },
    {
     "x": 3101,
     "y": 1523,
     "w": 139,
     "h": 33,
     "text": "required]"
    }
   ]
  },
  "t8": {
   "x": 516,
   "y": 1548,
   "w": 262,
   "h": 34,
   "lines": [
    {
     "x": 516,
     "y": 1548,
     "w": 262,
     "h": 34,
     "text": "[accept charges]"
    }
   ]
  }
 },
 "offPage": {},
 "marks": {},
 "phases": {},
 "rulesHaveSpans": {
  "vertical": true,
  "horizontal": true
 }
}
