{
 "schema": "ubl-activity-diagram-layout/1",
 "figure": "UBL-2.2-IMFM-TransportProgressStatus",
 "units": "px of the original PNG",
 "size": [
  3425,
  2366
 ],
 "style": {
  "fontPx": 74.3,
  "arrowPx": 97.0,
  "arrowWidthPx": 79.0,
  "arrowStyle": "open"
 },
 "rules": {
  "vertical": [
   {
    "at": 0,
    "width": 10,
    "span": [
     13,
     2352
    ]
   },
   {
    "at": 1704,
    "width": 8,
    "span": [
     13,
     2352
    ]
   },
   {
    "at": 3415,
    "width": 10,
    "span": [
     13,
     2352
    ]
   }
  ],
  "horizontal": [
   {
    "at": 0,
    "width": 10,
    "span": [
     13,
     3411
    ]
   },
   {
    "at": 2356,
    "width": 10,
    "span": [
     13,
     3411
    ]
   }
  ]
 },
 "greyRules": [],
 "lanes": {
  "lane-transport-service-provider": {
   "x0": 0,
   "x1": 1708,
   "titleBox": [
    438,
    65,
    837,
    66
   ]
  },
  "lane-transportation-network-manager": {
   "x0": 1708,
   "x1": 3425,
   "titleBox": [
    2057,
    66,
    1030,
    65
   ]
  }
 },
 "nodes": {
  "initial-transport-service-provider": {
   "x": 477,
   "y": 185,
   "w": 140,
   "h": 140
  },
  "object-transport-progress-status-request": {
   "x": 1356,
   "y": 655,
   "w": 705,
   "h": 330,
   "shape": "rect",
   "stroke": 15,
   "rx": 0,
   "ry": 0,
   "bold": true,
   "labelLines": [
    {
     "x": 1567,
     "y": 714,
     "w": 324,
     "h": 65,
     "text": "Transport"
    },
    {
     "x": 1434,
     "y": 790,
     "w": 536,
     "h": 67,
     "text": "Progress Status"
    },
    {
     "x": 1582,
     "y": 869,
     "w": 280,
     "h": 65,
     "text": "Request"
    }
   ]
  },
  "action-request-transport-progress-status": {
   "x": 89,
   "y": 666,
   "w": 938,
   "h": 316,
   "shape": "rounded",
   "stroke": 9,
   "rx": 104,
   "ry": 110,
   "bold": true,
   "labelLines": [
    {
     "x": 248,
     "y": 741,
     "w": 624,
     "h": 65,
     "text": "Request Transport"
    },
    {
     "x": 298,
     "y": 831,
     "w": 532,
     "h": 67,
     "text": "Progress Status"
    }
   ]
  },
  "action-receive-transport-progress-status-in-transportation-network-manager": {
   "x": 2390,
   "y": 666,
   "w": 937,
   "h": 316,
   "shape": "rounded",
   "stroke": 9,
   "rx": 104,
   "ry": 106,
   "bold": true,
   "labelLines": [
    {
     "x": 2549,
     "y": 741,
     "w": 611,
     "h": 65,
     "text": "Receive Transport"
    },
    {
     "x": 2443,
     "y": 831,
     "w": 835,
     "h": 67,
     "text": "Progress Status Request"
    }
   ]
  },
  "action-receive-transport-progress-status-in-transport-service-provider": {
   "x": 89,
   "y": 1533,
   "w": 938,
   "h": 324,
   "shape": "rounded",
   "stroke": 8,
   "rx": 101,
   "ry": 110,
   "bold": true,
   "labelLines": [
    {
     "x": 248,
     "y": 1618,
     "w": 612,
     "h": 65,
     "text": "Receive Transport"
    },
    {
     "x": 298,
     "y": 1709,
     "w": 532,
     "h": 67,
     "text": "Progress Status"
    }
   ]
  },
  "action-send-transport-progress-status": {
   "x": 2397,
   "y": 1533,
   "w": 937,
   "h": 324,
   "shape": "rounded",
   "stroke": 8,
   "rx": 101,
   "ry": 107,
   "bold": true,
   "labelLines": [
    {
     "x": 2441,
     "y": 1617,
     "w": 841,
     "h": 67,
     "text": "Send Transport Progress"
    },
    {
     "x": 2772,
     "y": 1709,
     "w": 210,
     "h": 53,
     "text": "Status"
    }
   ]
  },
  "object-transport-progress-status": {
   "x": 1349,
   "y": 1537,
   "w": 705,
   "h": 330,
   "shape": "rect",
   "stroke": 15,
   "rx": 0,
   "ry": 0,
   "bold": true,
   "labelLines": [
    {
     "x": 1560,
     "y": 1625,
     "w": 324,
     "h": 65,
     "text": "Transport"
    },
    {
     "x": 1441,
     "y": 1702,
     "w": 536,
     "h": 67,
     "text": "Progress Status"
    }
   ]
  },
  "final-transport-service-provider": {
   "x": 456,
   "y": 2147,
   "w": 126,
   "h": 126,
   "shape": "ellipse",
   "stroke": 8,
   "rx": 57,
   "ry": 65,
   "innerRatio": 0.444
  }
 },
 "flows": {
  "flow-initial-transport-service-provider-to-request-transport-progress-status": {
   "fromPoint": [
    548,
    339
   ],
   "toPoint": [
    553,
    651
   ],
   "routing": "straight"
  },
  "flow-request-transport-progress-status-to-transport-progress-status-request": {
   "fromPoint": [
    1041,
    824
   ],
   "toPoint": [
    1341,
    822
   ],
   "routing": "straight"
  },
  "flow-transport-progress-status-request-to-receive-transport-progress-status-in-transportation-network-manager": {
   "fromPoint": [
    2078,
    823
   ],
   "toPoint": [
    2375,
    824
   ],
   "routing": "straight"
  },
  "flow-receive-transport-progress-status-in-transportation-network-manager-to-send-transport-progress-status": {
   "fromPoint": [
    2864,
    996
   ],
   "toPoint": [
    2866,
    1518
   ],
   "routing": "straight"
  },
  "flow-transport-progress-status-to-receive-transport-progress-status-in-transport-service-provider": {
   "fromPoint": [
    1334,
    1701
   ],
   "toPoint": [
    1041,
    1696
   ],
   "routing": "straight"
  },
  "flow-send-transport-progress-status-to-transport-progress-status": {
   "fromPoint": [
    2382,
    1697
   ],
   "toPoint": [
    2071,
    1699
   ],
   "routing": "straight"
  },
  "flow-receive-transport-progress-status-in-transport-service-provider-to-final-transport-service-provider": {
   "fromPoint": [
    525,
    1871
   ],
   "toPoint": [
    520,
    2132
   ],
   "routing": "straight"
  }
 },
 "texts": {},
 "offPage": {},
 "marks": {},
 "phases": {},
 "rulesHaveSpans": {
  "vertical": true,
  "horizontal": true
 }
}
