{
 "schema": "ubl-activity-diagram-layout/1",
 "figure": "UBL-2.2-VMI-InitialStocking",
 "units": "px of the original PNG",
 "size": [
  3425,
  3499
 ],
 "style": {
  "fontPx": 55.7,
  "arrowPx": 56.0,
  "arrowWidthPx": 44.0,
  "arrowStyle": "open"
 },
 "rules": {
  "vertical": [
   {
    "at": 0,
    "width": 10,
    "span": [
     13,
     3485
    ]
   },
   {
    "at": 1263,
    "width": 4,
    "span": [
     13,
     3485
    ]
   },
   {
    "at": 3415,
    "width": 10,
    "span": [
     13,
     3485
    ]
   }
  ],
  "horizontal": [
   {
    "at": 0,
    "width": 10,
    "span": [
     13,
     3411
    ]
   },
   {
    "at": 3489,
    "width": 10,
    "span": [
     13,
     3411
    ]
   }
  ]
 },
 "greyRules": [],
 "lanes": {
  "lane-producer": {
   "x0": 0,
   "x1": 1265,
   "titleBox": [
    487,
    59,
    209,
    38
   ]
  },
  "lane-retailer": {
   "x0": 1265,
   "x1": 3425,
   "titleBox": [
    2222,
    60,
    178,
    38
   ]
  }
 },
 "nodes": {
  "initial-producer": {
   "x": 434,
   "y": 167,
   "w": 81,
   "h": 81
  },
  "action-calculate-the-initial-delivery": {
   "x": 86,
   "y": 528,
   "w": 768,
   "h": 109,
   "shape": "rounded",
   "stroke": 5,
   "rx": 54,
   "ry": 31,
   "bold": true,
   "labelLines": [
    {
     "x": 110,
     "y": 568,
     "w": 690,
     "h": 50,
     "text": "Calculate the initial delivery"
    }
   ]
  },
  "object-catalogue": {
   "x": 1095,
   "y": 854,
   "w": 336,
   "h": 133,
   "shape": "rect",
   "stroke": 9,
   "rx": 0,
   "ry": 0,
   "bold": true,
   "labelLines": [
    {
     "x": 1145,
     "y": 896,
     "w": 250,
     "h": 50,
     "text": "Catalogue"
    }
   ]
  },
  "action-receive-catalogue": {
   "x": 1850,
   "y": 856,
   "w": 538,
   "h": 125,
   "shape": "rounded",
   "stroke": 5,
   "rx": 61,
   "ry": 40,
   "bold": true,
   "labelLines": [
    {
     "x": 1880,
     "y": 896,
     "w": 462,
     "h": 50,
     "text": "Receive Catalogue"
    }
   ]
  },
  "action-update-products-database": {
   "x": 2591,
   "y": 856,
   "w": 748,
   "h": 125,
   "shape": "rounded",
   "stroke": 5,
   "rx": 61,
   "ry": 35,
   "bold": true,
   "labelLines": [
    {
     "x": 2636,
     "y": 897,
     "w": 656,
     "h": 48,
     "text": "Update products database"
    }
   ]
  },
  "action-send-catalogue": {
   "x": 203,
   "y": 860,
   "w": 538,
   "h": 125,
   "shape": "rounded",
   "stroke": 5,
   "rx": 61,
   "ry": 40,
   "bold": true,
   "labelLines": [
    {
     "x": 267,
     "y": 900,
     "w": 394,
     "h": 50,
     "text": "Send Catalogue"
    }
   ]
  },
  "object-despatch-advice": {
   "x": 1043,
   "y": 1214,
   "w": 449,
   "h": 134,
   "shape": "rect",
   "stroke": 8,
   "rx": 0,
   "ry": 0,
   "bold": true,
   "labelLines": [
    {
     "x": 1063,
     "y": 1257,
     "w": 421,
     "h": 48,
     "text": "Despatch Advice"
    }
   ]
  },
  "action-send-despatch-advice": {
   "x": 163,
   "y": 1220,
   "w": 618,
   "h": 126,
   "shape": "rounded",
   "stroke": 4,
   "rx": 61.0,
   "ry": 35,
   "bold": true,
   "labelLines": [
    {
     "x": 186,
     "y": 1261,
     "w": 564,
     "h": 49,
     "text": "Send Despatch Advice"
    }
   ]
  },
  "action-receive-despatch-advice": {
   "x": 1785,
   "y": 1220,
   "w": 805,
   "h": 126,
   "shape": "rounded",
   "stroke": 4,
   "rx": 61.0,
   "ry": 50,
   "bold": true,
   "labelLines": [
    {
     "x": 1868,
     "y": 1261,
     "w": 632,
     "h": 49,
     "text": "Receive Despatch Advice"
    }
   ]
  },
  "action-despatch-item-s": {
   "x": 159,
   "y": 1625,
   "w": 614,
   "h": 125,
   "shape": "rounded",
   "stroke": 4,
   "rx": 61.0,
   "ry": 35,
   "bold": true,
   "labelLines": [
    {
     "x": 261,
     "y": 1665,
     "w": 418,
     "h": 50,
     "text": "Despatch item(s)"
    }
   ]
  },
  "action-receive-item-s": {
   "x": 1814,
   "y": 1629,
   "w": 614,
   "h": 125,
   "shape": "rounded",
   "stroke": 4,
   "rx": 61.0,
   "ry": 37,
   "bold": true,
   "labelLines": [
    {
     "x": 1928,
     "y": 1670,
     "w": 380,
     "h": 49,
     "text": "Receive item(s)"
    }
   ]
  },
  "fork-retailer": {
   "x": 1919,
   "y": 1994,
   "w": 1242,
   "h": 24
  },
  "action-check-status-of-item-s": {
   "x": 2226,
   "y": 2314,
   "w": 619,
   "h": 129,
   "shape": "rounded",
   "stroke": 5,
   "rx": 58,
   "ry": 57,
   "bold": true,
   "labelLines": [
    {
     "x": 2255,
     "y": 2354,
     "w": 574,
     "h": 49,
     "text": "Check status of item(s)"
    }
   ]
  },
  "object-receipt-advice": {
   "x": 1043,
   "y": 2636,
   "w": 449,
   "h": 137,
   "shape": "rect",
   "stroke": 9,
   "rx": 0,
   "ry": 0,
   "bold": true,
   "labelLines": [
    {
     "x": 1083,
     "y": 2679,
     "w": 374,
     "h": 48,
     "text": "Receipt Advice"
    }
   ]
  },
  "action-send-receipt-advice": {
   "x": 2222,
   "y": 2638,
   "w": 619,
   "h": 125,
   "shape": "rounded",
   "stroke": 5,
   "rx": 62,
   "ry": 43,
   "bold": true,
   "labelLines": [
    {
     "x": 2267,
     "y": 2678,
     "w": 516,
     "h": 49,
     "text": "Send Receipt Advice"
    }
   ]
  },
  "action-receive-receipt-advice": {
   "x": 195,
   "y": 2646,
   "w": 619,
   "h": 121,
   "shape": "rounded",
   "stroke": 5,
   "rx": 61,
   "ry": 38,
   "bold": true,
   "labelLines": [
    {
     "x": 208,
     "y": 2687,
     "w": 586,
     "h": 48,
     "text": "Receive Receipt Advice"
    }
   ]
  },
  "action-adjust-supply-status": {
   "x": 195,
   "y": 2957,
   "w": 619,
   "h": 130,
   "shape": "rounded",
   "stroke": 4,
   "rx": 61.0,
   "ry": 41,
   "bold": true,
   "labelLines": [
    {
     "x": 254,
     "y": 2999,
     "w": 514,
     "h": 49,
     "text": "Adjust supply status"
    }
   ]
  },
  "final-producer": {
   "x": 470,
   "y": 3334,
   "w": 73,
   "h": 73,
   "shape": "rounded",
   "stroke": 4,
   "rx": 38,
   "ry": 37,
   "innerRatio": 0.438
  }
 },
 "flows": {
  "flow-initial-producer-to-calculate-the-initial-delivery": {
   "fromPoint": [
    473,
    262
   ],
   "toPoint": [
    470,
    513
   ],
   "routing": "straight"
  },
  "flow-calculate-the-initial-delivery-to-send-catalogue": {
   "fromPoint": [
    471,
    651
   ],
   "toPoint": [
    472,
    845
   ],
   "routing": "straight"
  },
  "flow-catalogue-to-receive-catalogue": {
   "fromPoint": [
    1445,
    918
   ],
   "toPoint": [
    1835,
    918
   ],
   "routing": "straight"
  },
  "flow-receive-catalogue-to-update-products-database": {
   "fromPoint": [
    2402,
    918
   ],
   "toPoint": [
    2576,
    918
   ],
   "routing": "straight"
  },
  "flow-send-catalogue-to-catalogue": {
   "fromPoint": [
    755,
    922
   ],
   "toPoint": [
    1080,
    922
   ],
   "routing": "straight"
  },
  "flow-update-products-database-to-fork-retailer": {
   "fromPoint": [
    2960,
    995
   ],
   "toPoint": [
    2960,
    1979
   ],
   "routing": "straight"
  },
  "flow-send-catalogue-to-send-despatch-advice": {
   "fromPoint": [
    472,
    999
   ],
   "toPoint": [
    472,
    1205
   ],
   "routing": "straight"
  },
  "flow-send-despatch-advice-to-despatch-advice": {
   "fromPoint": [
    795,
    1283
   ],
   "toPoint": [
    1028,
    1282
   ],
   "routing": "straight"
  },
  "flow-despatch-advice-to-receive-despatch-advice": {
   "fromPoint": [
    1506,
    1282
   ],
   "toPoint": [
    1770,
    1283
   ],
   "routing": "straight"
  },
  "flow-send-despatch-advice-to-despatch-item-s": {
   "fromPoint": [
    469,
    1360
   ],
   "toPoint": [
    466,
    1610
   ],
   "routing": "straight"
  },
  "flow-receive-despatch-advice-to-fork-retailer": {
   "fromPoint": [
    2539,
    1360
   ],
   "toPoint": [
    2540,
    1979
   ],
   "routing": "straight"
  },
  "flow-despatch-item-s-to-receive-item-s": {
   "fromPoint": [
    787,
    1687
   ],
   "toPoint": [
    1799,
    1687
   ],
   "routing": "straight"
  },
  "flow-receive-item-s-to-fork-retailer": {
   "fromPoint": [
    2118,
    1768
   ],
   "toPoint": [
    2118,
    1979
   ],
   "routing": "straight"
  },
  "flow-fork-retailer-to-check-status-of-item-s": {
   "fromPoint": [
    2540,
    2032
   ],
   "toPoint": [
    2538,
    2299
   ],
   "routing": "straight"
  },
  "flow-check-status-of-item-s-to-send-receipt-advice": {
   "fromPoint": [
    2532,
    2457
   ],
   "toPoint": [
    2531,
    2623
   ],
   "routing": "straight"
  },
  "flow-send-receipt-advice-to-receipt-advice": {
   "fromPoint": [
    2207,
    2700
   ],
   "toPoint": [
    1506,
    2700
   ],
   "routing": "straight"
  },
  "flow-receipt-advice-to-receive-receipt-advice": {
   "fromPoint": [
    1028,
    2703
   ],
   "toPoint": [
    828,
    2704
   ],
   "routing": "straight"
  },
  "flow-receive-receipt-advice-to-adjust-supply-status": {
   "fromPoint": [
    504,
    2781
   ],
   "toPoint": [
    504,
    2942
   ],
   "routing": "straight"
  },
  "flow-adjust-supply-status-to-final-producer": {
   "fromPoint": [
    504,
    3101
   ],
   "toPoint": [
    504,
    3319
   ],
   "routing": "straight"
  }
 },
 "texts": {},
 "offPage": {},
 "marks": {},
 "phases": {},
 "rulesHaveSpans": {
  "vertical": true,
  "horizontal": true
 }
}
